{
  "meta": {
    "schemaVersion": "1.2.0",
    "gameId": "idle-routine-valid"
  },
  "systems": {
    "tickMs": 100
  },
  "state": {
    "resources": {
      "xp": 0
    },
    "layers": {
      "idle": {
        "routinePools": {
          "workerSlots": {
            "total": 1,
            "used": 0,
            "activeRoutineId": null
          }
        }
      }
    }
  },
  "layers": [
    {
      "id": "idle",
      "type": "progressLayer",
      "routineSystem": {
        "slotPools": {
          "workerSlots": {
            "totalPath": "layers.idle.routinePools.workerSlots.total",
            "usedPath": "layers.idle.routinePools.workerSlots.used",
            "activeRoutineIdPath": "layers.idle.routinePools.workerSlots.activeRoutineId",
            "singleActivePerPool": true
          }
        }
      },
      "sublayers": [
        {
          "id": "routines",
          "type": "progress",
          "sections": [
            {
              "id": "jobs",
              "elements": [
                {
                  "id": "woodcut-routine",
                  "type": "routine",
                  "unlock": {
                    "always": true
                  },
                  "slot": {
                    "poolId": "workerSlots",
                    "cost": 1
                  },
                  "mode": "manual",
                  "produces": [
                    {
                      "path": "resources.xp",
                      "perSecond": 1
                    }
                  ]
                }
              ]
            }
          ]
        }
      ]
    }
  ]
}
